{"$schema":"https://json-schema.org/draft/2020-12/schema","title":"Life-account links document","type":"object","additionalProperties":false,"required":["schema_version","status","source_of_truth","links"],"properties":{"schema_version":{"type":"string"},"status":{"enum":["draft","stable"]},"source_of_truth":{"type":"string","minLength":1},"links":{"type":"array","items":{"$ref":"life-account-link.schema.json"}}}}
